"path","category","source","title","description","search_keywords"
"assets/images/banners/banner_artisan.jpg","banner","banners.json","Craft, cycle, discover","Mix artisan ateliers, heritage houses, and active days in one curated itinerary.","Tunisia travel banner, Craft, cycle, discover, Plan route"
"assets/images/banners/banner_blue_doors.jpg","banner","banners.json","Stay by the blue doors","Warm courtyards, boutique stays, and handcrafted local routes.","Tunisia travel banner, Stay by the blue doors, Create stay"
"assets/images/banners/banner_culinary.jpg","banner","banners.json","Taste Tunisia slowly","From medina tables to coastal kitchens, book food-first stops with real local value.","Tunisia travel banner, Taste Tunisia slowly, Explore food"
"assets/images/banners/banner_oasis.jpg","banner","banners.json","Desert, oasis, coast","Build multi-region trips across Tunisia with budget-aware local recommendations.","Tunisia travel banner, Desert, oasis, coast, Start planner"
"assets/images/mockups/artisan.jpg","mockup","lib/interests","Artisan interest","Interest card image for handcrafted products.","artisan Tunisia, workshop, handmade products"
"assets/images/mockups/crafts.jpg","mockup","lib/interests","Crafts interest","Interest card image for local crafts.","Tunisian crafts, pottery, weaving, handmade"
"assets/images/mockups/cuisine.jpg","mockup","lib/interests","Cuisine interest","Interest card image for traditional cuisine.","Tunisian cuisine, couscous, brik, local food"
"assets/images/mockups/cycling.jpg","mockup","lib/interests","Cycling interest","Interest card image for cycling.","cycling Tunisia, coastal road, bike trip"
"assets/images/mockups/horse_riding.jpg","mockup","lib/interests","Horse riding interest","Interest card image for horse riding activity.","horse riding Tunisia, desert trail, adventure"
"assets/images/mockups/nature.jpg","mockup","lib/interests","Nature interest","Interest card image for nature exploration.","Tunisia nature, mountain, forest, landscape"
"assets/images/mockups/planner_cover.jpg","mockup","lib/planner","Planner cover","Cover image for trip planner experience.","travel planner, Tunisia itinerary, notebook map"
"assets/images/mockups/tunisia_map.jpg","mockup","lib/governorates","Tunisia map","Map visual used on governorates exploration page.","Tunisia map outline, governorates map, transparent"
"assets/images/onboarding/auth_cover.jpg","onboarding","lib/auth","Auth cover","Welcoming visual for sign in and auth landing screens.","Tunisia travelers, welcome, medina, lifestyle"
"assets/images/onboarding/discover_tunisia.jpg","onboarding","lib/onboarding","Discover Tunisia","Hero visual introducing Tunisia discovery journey.","Tunisia travel aerial, medina, coast, discovery"
"assets/images/onboarding/splash_cover.jpg","onboarding","lib/splash","Splash cover","Main splash image for app launch screen.","Tunisia iconic landscape, opening screen"
"assets/images/onboarding/support_locals.jpg","onboarding","lib/onboarding","Support locals","Visual about local artisans, community, and responsible tourism.","Tunisian artisans, local community, handmade, workshop"
"assets/images/onboarding/travel_smart.jpg","onboarding","lib/onboarding","Travel smart","Visual about itinerary planning and meaningful travel.","Tunisia route planning, smart travel, map, journey"
"assets/images/places/ariana_accommodation_1.jpg","place-main-accommodation","places.json","Dar Ariana Rooftop House","Boutique courtyard stay curated for culture-led city breaks. A design-led local stay in Ariana with breakfast, concierge help, and nearby heritage routes.","Ariana Tunisia, accommodation, Heritage, Boutique, Local Partner, Family, Food, local travel"
"assets/images/places/ariana_accommodation_2.jpg","place-main-accommodation","places.json","Ariana Medina Guest Lodge","Comfortable guest stay with easy access to local food and activities. Flexible stay option in Ariana suited to couples, families, and friends exploring the region.","Ariana Tunisia, accommodation, Nature, Comfort, Family, Family, Food, local travel"
"assets/images/places/ariana_accommodation_21.jpg","place-gallery-accommodation","places.json","Dar Ariana Rooftop House gallery","Secondary gallery view for Dar Ariana Rooftop House in Ariana.","Ariana Tunisia, accommodation, Heritage, Boutique, Local Partner, Family, Food, gallery"
"assets/images/places/ariana_accommodation_22.jpg","place-gallery-accommodation","places.json","Ariana Medina Guest Lodge gallery","Secondary gallery view for Ariana Medina Guest Lodge in Ariana.","Ariana Tunisia, accommodation, Nature, Comfort, Family, Family, Food, gallery"
"assets/images/places/ariana_activity_27.jpg","place-gallery-activity","places.json","Ariana Cycling Escape gallery","Secondary gallery view for Ariana Cycling Escape in Ariana.","Ariana Tunisia, activity, Cycling, Adventure, Nature, Family, Food, gallery"
"assets/images/places/ariana_activity_28.jpg","place-gallery-activity","places.json","Ariana City Adventure Trail gallery","Secondary gallery view for Ariana City Adventure Trail in Ariana.","Ariana Tunisia, activity, Adventure, Guided, Nature, Family, Food, gallery"
"assets/images/places/ariana_activity_7.jpg","place-main-activity","places.json","Ariana Cycling Escape","Guided cycling route linking scenic stops, food breaks, and local encounters. A cycle-friendly route in Ariana designed for curious travelers seeking active discovery.","Ariana Tunisia, activity, Cycling, Adventure, Nature, Family, Food, local travel"
"assets/images/places/ariana_activity_8.jpg","place-main-activity","places.json","Ariana City Adventure Trail","Immersive active outing with local guides and strong sense of place. Bookable outdoor adventure in Ariana with local guide support, stories, and practical logistics included.","Ariana Tunisia, activity, Adventure, Guided, Nature, Family, Food, local travel"
"assets/images/places/ariana_artisan_25.jpg","place-gallery-artisan","places.json","Ariana Heritage Atelier gallery","Secondary gallery view for Ariana Heritage Atelier in Ariana.","Ariana Tunisia, artisan, Artisan, Workshop, Local Partner, Family, Food, gallery"
"assets/images/places/ariana_artisan_26.jpg","place-gallery-artisan","places.json","Blue Door Crafts Ariana gallery","Secondary gallery view for Blue Door Crafts Ariana in Ariana.","Ariana Tunisia, artisan, Artisan, Design, Handmade, Family, Food, gallery"
"assets/images/places/ariana_artisan_5.jpg","place-main-artisan","places.json","Ariana Heritage Atelier","Meet makers preserving regional craft gestures through hands-on workshops. Local artisan studio in Ariana offering demonstrations, small-batch products, and cultural context.","Ariana Tunisia, artisan, Artisan, Workshop, Local Partner, Family, Food, local travel"
"assets/images/places/ariana_artisan_6.jpg","place-main-artisan","places.json","Blue Door Crafts Ariana","Textile, ceramics, or woodwork collections inspired by Tunisian detail. Curated artisan address in Ariana where travelers can shop responsibly and learn about local techniques.","Ariana Tunisia, artisan, Artisan, Design, Handmade, Family, Food, local travel"
"assets/images/places/ariana_museum_29.jpg","place-gallery-museum","places.json","Ariana Living Heritage House gallery","Secondary gallery view for Ariana Living Heritage House in Ariana.","Ariana Tunisia, museum, Heritage, Museum, Culture, Family, Food, gallery"
"assets/images/places/ariana_museum_9.jpg","place-main-museum","places.json","Ariana Living Heritage House","Compact cultural stop connecting architecture, objects, and stories of the region. A heritage venue in Ariana presenting architecture, memory, and craft in a visitor-friendly format.","Ariana Tunisia, museum, Heritage, Museum, Culture, Family, Food, local travel"
"assets/images/places/ariana_naturespot_11.jpg","place-main-natureSpot","places.json","Ariana Rooftop Nature Lookout","Scenic stop for slow walks, light hikes, and panoramic views. Accessible nature point in Ariana offering guided walks, open views, and easy half-day planning.","Ariana Tunisia, natureSpot, Nature, Panorama, Family, Family, Food, local travel"
"assets/images/places/ariana_naturespot_31.jpg","place-gallery-natureSpot","places.json","Ariana Rooftop Nature Lookout gallery","Secondary gallery view for Ariana Rooftop Nature Lookout in Ariana.","Ariana Tunisia, natureSpot, Nature, Panorama, Family, Family, Food, gallery"
"assets/images/places/ariana_restaurant_23.jpg","place-gallery-restaurant","places.json","Ariana Medina Table gallery","Secondary gallery view for Ariana Medina Table in Ariana.","Ariana Tunisia, restaurant, Culinary, Traditional, Local Partner, Family, Food, gallery"
"assets/images/places/ariana_restaurant_24.jpg","place-gallery-restaurant","places.json","Olive Route Kitchen Ariana gallery","Secondary gallery view for Olive Route Kitchen Ariana in Ariana.","Ariana Tunisia, restaurant, Culinary, Chef table, Food, Family, Food, gallery"
"assets/images/places/ariana_restaurant_3.jpg","place-main-restaurant","places.json","Ariana Medina Table","Seasonal Tunisian dishes, market ingredients, and generous local hospitality. A reliable culinary stop in Ariana focused on regional recipes, tasting plates, and warm service.","Ariana Tunisia, restaurant, Culinary, Traditional, Local Partner, Family, Food, local travel"
"assets/images/places/ariana_restaurant_4.jpg","place-main-restaurant","places.json","Olive Route Kitchen Ariana","Modern local dining with shared plates and regional produce. Contemporary Tunisian cooking in Ariana with polished plating and seasonal menus.","Ariana Tunisia, restaurant, Culinary, Chef table, Food, Family, Food, local travel"
"assets/images/places/ariana_transport_10.jpg","place-main-transport","places.json","Ariana Local Ride Collective","Private and shared transfer options connecting stations, stays, and key sights. Reliable local transport partner in Ariana with airport, station, city, and day-trip options.","Ariana Tunisia, transport, Transport, Private ride, Local Partner, Family, Food, local travel"
"assets/images/places/ariana_transport_30.jpg","place-gallery-transport","places.json","Ariana Local Ride Collective gallery","Secondary gallery view for Ariana Local Ride Collective in Ariana.","Ariana Tunisia, transport, Transport, Private ride, Local Partner, Family, Food, gallery"
"assets/images/places/beja_accommodation_1.jpg","place-main-accommodation","places.json","Dar Beja Olive House","Boutique courtyard stay curated for culture-led city breaks. A design-led local stay in Beja with breakfast, concierge help, and nearby heritage routes.","Beja Tunisia, accommodation, Heritage, Boutique, Local Partner, Countryside, Food, local travel"
"assets/images/places/beja_accommodation_2.jpg","place-main-accommodation","places.json","Beja Field Guest Lodge","Comfortable guest stay with easy access to local food and activities. Flexible stay option in Beja suited to couples, families, and friends exploring the region.","Beja Tunisia, accommodation, Nature, Comfort, Family, Countryside, Food, local travel"
"assets/images/places/beja_accommodation_21.jpg","place-gallery-accommodation","places.json","Dar Beja Olive House gallery","Secondary gallery view for Dar Beja Olive House in Beja.","Beja Tunisia, accommodation, Heritage, Boutique, Local Partner, Countryside, Food, gallery"
"assets/images/places/beja_accommodation_22.jpg","place-gallery-accommodation","places.json","Beja Field Guest Lodge gallery","Secondary gallery view for Beja Field Guest Lodge in Beja.","Beja Tunisia, accommodation, Nature, Comfort, Family, Countryside, Food, gallery"
"assets/images/places/beja_activity_27.jpg","place-gallery-activity","places.json","Beja Cycling Escape gallery","Secondary gallery view for Beja Cycling Escape in Beja.","Beja Tunisia, activity, Cycling, Adventure, Nature, Countryside, Food, gallery"
"assets/images/places/beja_activity_28.jpg","place-gallery-activity","places.json","Beja Village Adventure Trail gallery","Secondary gallery view for Beja Village Adventure Trail in Beja.","Beja Tunisia, activity, Adventure, Guided, Nature, Countryside, Food, gallery"
"assets/images/places/beja_activity_7.jpg","place-main-activity","places.json","Beja Cycling Escape","Guided cycling route linking scenic stops, food breaks, and local encounters. A cycle-friendly route in Beja designed for curious travelers seeking active discovery.","Beja Tunisia, activity, Cycling, Adventure, Nature, Countryside, Food, local travel"
"assets/images/places/beja_activity_8.jpg","place-main-activity","places.json","Beja Village Adventure Trail","Immersive active outing with local guides and strong sense of place. Bookable outdoor adventure in Beja with local guide support, stories, and practical logistics included.","Beja Tunisia, activity, Adventure, Guided, Nature, Countryside, Food, local travel"
"assets/images/places/beja_artisan_25.jpg","place-gallery-artisan","places.json","Beja Heritage Atelier gallery","Secondary gallery view for Beja Heritage Atelier in Beja.","Beja Tunisia, artisan, Artisan, Workshop, Local Partner, Countryside, Food, gallery"
"assets/images/places/beja_artisan_26.jpg","place-gallery-artisan","places.json","Blue Door Crafts Beja gallery","Secondary gallery view for Blue Door Crafts Beja in Beja.","Beja Tunisia, artisan, Artisan, Design, Handmade, Countryside, Food, gallery"
"assets/images/places/beja_artisan_5.jpg","place-main-artisan","places.json","Beja Heritage Atelier","Meet makers preserving regional craft gestures through hands-on workshops. Local artisan studio in Beja offering demonstrations, small-batch products, and cultural context.","Beja Tunisia, artisan, Artisan, Workshop, Local Partner, Countryside, Food, local travel"
"assets/images/places/beja_artisan_6.jpg","place-main-artisan","places.json","Blue Door Crafts Beja","Textile, ceramics, or woodwork collections inspired by Tunisian detail. Curated artisan address in Beja where travelers can shop responsibly and learn about local techniques.","Beja Tunisia, artisan, Artisan, Design, Handmade, Countryside, Food, local travel"
"assets/images/places/beja_museum_29.jpg","place-gallery-museum","places.json","Beja Living Heritage House gallery","Secondary gallery view for Beja Living Heritage House in Beja.","Beja Tunisia, museum, Heritage, Museum, Culture, Countryside, Food, gallery"
"assets/images/places/beja_museum_9.jpg","place-main-museum","places.json","Beja Living Heritage House","Compact cultural stop connecting architecture, objects, and stories of the region. A heritage venue in Beja presenting architecture, memory, and craft in a visitor-friendly format.","Beja Tunisia, museum, Heritage, Museum, Culture, Countryside, Food, local travel"
"assets/images/places/beja_naturespot_11.jpg","place-main-natureSpot","places.json","Beja Olive Nature Lookout","Scenic stop for slow walks, light hikes, and panoramic views. Accessible nature point in Beja offering guided walks, open views, and easy half-day planning.","Beja Tunisia, natureSpot, Nature, Panorama, Family, Countryside, Food, local travel"
"assets/images/places/beja_naturespot_31.jpg","place-gallery-natureSpot","places.json","Beja Olive Nature Lookout gallery","Secondary gallery view for Beja Olive Nature Lookout in Beja.","Beja Tunisia, natureSpot, Nature, Panorama, Family, Countryside, Food, gallery"
"assets/images/places/beja_restaurant_23.jpg","place-gallery-restaurant","places.json","Beja Medina Table gallery","Secondary gallery view for Beja Medina Table in Beja.","Beja Tunisia, restaurant, Culinary, Traditional, Local Partner, Countryside, Food, gallery"
"assets/images/places/beja_restaurant_24.jpg","place-gallery-restaurant","places.json","Olive Route Kitchen Beja gallery","Secondary gallery view for Olive Route Kitchen Beja in Beja.","Beja Tunisia, restaurant, Culinary, Chef table, Food, Countryside, Food, gallery"
"assets/images/places/beja_restaurant_3.jpg","place-main-restaurant","places.json","Beja Medina Table","Seasonal Tunisian dishes, market ingredients, and generous local hospitality. A reliable culinary stop in Beja focused on regional recipes, tasting plates, and warm service.","Beja Tunisia, restaurant, Culinary, Traditional, Local Partner, Countryside, Food, local travel"
"assets/images/places/beja_restaurant_4.jpg","place-main-restaurant","places.json","Olive Route Kitchen Beja","Modern local dining with shared plates and regional produce. Contemporary Tunisian cooking in Beja with polished plating and seasonal menus.","Beja Tunisia, restaurant, Culinary, Chef table, Food, Countryside, Food, local travel"
"assets/images/places/beja_transport_10.jpg","place-main-transport","places.json","Beja Local Ride Collective","Private and shared transfer options connecting stations, stays, and key sights. Reliable local transport partner in Beja with airport, station, city, and day-trip options.","Beja Tunisia, transport, Transport, Private ride, Local Partner, Countryside, Food, local travel"
"assets/images/places/beja_transport_30.jpg","place-gallery-transport","places.json","Beja Local Ride Collective gallery","Secondary gallery view for Beja Local Ride Collective in Beja.","Beja Tunisia, transport, Transport, Private ride, Local Partner, Countryside, Food, gallery"
"assets/images/places/ben-arous_accommodation_1.jpg","place-main-accommodation","places.json","Dar Ben Arous Rooftop House","Boutique courtyard stay curated for culture-led city breaks. A design-led local stay in Ben Arous with breakfast, concierge help, and nearby heritage routes.","Ben Arous Tunisia, accommodation, Heritage, Boutique, Local Partner, Local life, Cuisine, local travel"
"assets/images/places/ben-arous_accommodation_2.jpg","place-main-accommodation","places.json","Ben Arous Medina Guest Lodge","Comfortable guest stay with easy access to local food and activities. Flexible stay option in Ben Arous suited to couples, families, and friends exploring the region.","Ben Arous Tunisia, accommodation, Nature, Comfort, Family, Local life, Cuisine, local travel"
"assets/images/places/ben-arous_accommodation_21.jpg","place-gallery-accommodation","places.json","Dar Ben Arous Rooftop House gallery","Secondary gallery view for Dar Ben Arous Rooftop House in Ben Arous.","Ben Arous Tunisia, accommodation, Heritage, Boutique, Local Partner, Local life, Cuisine, gallery"
"assets/images/places/ben-arous_accommodation_22.jpg","place-gallery-accommodation","places.json","Ben Arous Medina Guest Lodge gallery","Secondary gallery view for Ben Arous Medina Guest Lodge in Ben Arous.","Ben Arous Tunisia, accommodation, Nature, Comfort, Family, Local life, Cuisine, gallery"
"assets/images/places/ben-arous_activity_27.jpg","place-gallery-activity","places.json","Ben Arous Cycling Escape gallery","Secondary gallery view for Ben Arous Cycling Escape in Ben Arous.","Ben Arous Tunisia, activity, Cycling, Adventure, Nature, Local life, Cuisine, gallery"
"assets/images/places/ben-arous_activity_28.jpg","place-gallery-activity","places.json","Ben Arous City Adventure Trail gallery","Secondary gallery view for Ben Arous City Adventure Trail in Ben Arous.","Ben Arous Tunisia, activity, Adventure, Guided, Nature, Local life, Cuisine, gallery"
"assets/images/places/ben-arous_activity_7.jpg","place-main-activity","places.json","Ben Arous Cycling Escape","Guided cycling route linking scenic stops, food breaks, and local encounters. A cycle-friendly route in Ben Arous designed for curious travelers seeking active discovery.","Ben Arous Tunisia, activity, Cycling, Adventure, Nature, Local life, Cuisine, local travel"
"assets/images/places/ben-arous_activity_8.jpg","place-main-activity","places.json","Ben Arous City Adventure Trail","Immersive active outing with local guides and strong sense of place. Bookable outdoor adventure in Ben Arous with local guide support, stories, and practical logistics included.","Ben Arous Tunisia, activity, Adventure, Guided, Nature, Local life, Cuisine, local travel"
"assets/images/places/ben-arous_artisan_25.jpg","place-gallery-artisan","places.json","Ben Arous Heritage Atelier gallery","Secondary gallery view for Ben Arous Heritage Atelier in Ben Arous.","Ben Arous Tunisia, artisan, Artisan, Workshop, Local Partner, Local life, Cuisine, gallery"
"assets/images/places/ben-arous_artisan_26.jpg","place-gallery-artisan","places.json","Blue Door Crafts Ben Arous gallery","Secondary gallery view for Blue Door Crafts Ben Arous in Ben Arous.","Ben Arous Tunisia, artisan, Artisan, Design, Handmade, Local life, Cuisine, gallery"
"assets/images/places/ben-arous_artisan_5.jpg","place-main-artisan","places.json","Ben Arous Heritage Atelier","Meet makers preserving regional craft gestures through hands-on workshops. Local artisan studio in Ben Arous offering demonstrations, small-batch products, and cultural context.","Ben Arous Tunisia, artisan, Artisan, Workshop, Local Partner, Local life, Cuisine, local travel"
"assets/images/places/ben-arous_artisan_6.jpg","place-main-artisan","places.json","Blue Door Crafts Ben Arous","Textile, ceramics, or woodwork collections inspired by Tunisian detail. Curated artisan address in Ben Arous where travelers can shop responsibly and learn about local techniques.","Ben Arous Tunisia, artisan, Artisan, Design, Handmade, Local life, Cuisine, local travel"
"assets/images/places/ben-arous_museum_29.jpg","place-gallery-museum","places.json","Ben Arous Living Heritage House gallery","Secondary gallery view for Ben Arous Living Heritage House in Ben Arous.","Ben Arous Tunisia, museum, Heritage, Museum, Culture, Local life, Cuisine, gallery"
"assets/images/places/ben-arous_museum_9.jpg","place-main-museum","places.json","Ben Arous Living Heritage House","Compact cultural stop connecting architecture, objects, and stories of the region. A heritage venue in Ben Arous presenting architecture, memory, and craft in a visitor-friendly format.","Ben Arous Tunisia, museum, Heritage, Museum, Culture, Local life, Cuisine, local travel"
"assets/images/places/ben-arous_naturespot_11.jpg","place-main-natureSpot","places.json","Ben Arous Rooftop Nature Lookout","Scenic stop for slow walks, light hikes, and panoramic views. Accessible nature point in Ben Arous offering guided walks, open views, and easy half-day planning.","Ben Arous Tunisia, natureSpot, Nature, Panorama, Family, Local life, Cuisine, local travel"
"assets/images/places/ben-arous_naturespot_31.jpg","place-gallery-natureSpot","places.json","Ben Arous Rooftop Nature Lookout gallery","Secondary gallery view for Ben Arous Rooftop Nature Lookout in Ben Arous.","Ben Arous Tunisia, natureSpot, Nature, Panorama, Family, Local life, Cuisine, gallery"
"assets/images/places/ben-arous_restaurant_23.jpg","place-gallery-restaurant","places.json","Ben Arous Medina Table gallery","Secondary gallery view for Ben Arous Medina Table in Ben Arous.","Ben Arous Tunisia, restaurant, Culinary, Traditional, Local Partner, Local life, Cuisine, gallery"
"assets/images/places/ben-arous_restaurant_24.jpg","place-gallery-restaurant","places.json","Olive Route Kitchen Ben Arous gallery","Secondary gallery view for Olive Route Kitchen Ben Arous in Ben Arous.","Ben Arous Tunisia, restaurant, Culinary, Chef table, Food, Local life, Cuisine, gallery"
"assets/images/places/ben-arous_restaurant_3.jpg","place-main-restaurant","places.json","Ben Arous Medina Table","Seasonal Tunisian dishes, market ingredients, and generous local hospitality. A reliable culinary stop in Ben Arous focused on regional recipes, tasting plates, and warm service.","Ben Arous Tunisia, restaurant, Culinary, Traditional, Local Partner, Local life, Cuisine, local travel"
"assets/images/places/ben-arous_restaurant_4.jpg","place-main-restaurant","places.json","Olive Route Kitchen Ben Arous","Modern local dining with shared plates and regional produce. Contemporary Tunisian cooking in Ben Arous with polished plating and seasonal menus.","Ben Arous Tunisia, restaurant, Culinary, Chef table, Food, Local life, Cuisine, local travel"
"assets/images/places/ben-arous_transport_10.jpg","place-main-transport","places.json","Ben Arous Local Ride Collective","Private and shared transfer options connecting stations, stays, and key sights. Reliable local transport partner in Ben Arous with airport, station, city, and day-trip options.","Ben Arous Tunisia, transport, Transport, Private ride, Local Partner, Local life, Cuisine, local travel"
"assets/images/places/ben-arous_transport_30.jpg","place-gallery-transport","places.json","Ben Arous Local Ride Collective gallery","Secondary gallery view for Ben Arous Local Ride Collective in Ben Arous.","Ben Arous Tunisia, transport, Transport, Private ride, Local Partner, Local life, Cuisine, gallery"
"assets/images/places/bizerte_accommodation_1.jpg","place-main-accommodation","places.json","Dar Bizerte Sea House","Boutique courtyard stay curated for culture-led city breaks. A design-led local stay in Bizerte with breakfast, concierge help, and nearby heritage routes.","Bizerte Tunisia, accommodation, Heritage, Boutique, Local Partner, Sea, Cliffs, local travel"
"assets/images/places/bizerte_accommodation_2.jpg","place-main-accommodation","places.json","Bizerte Harbor Guest Lodge","Comfortable guest stay with easy access to local food and activities. Flexible stay option in Bizerte suited to couples, families, and friends exploring the region.","Bizerte Tunisia, accommodation, Nature, Comfort, Family, Sea, Cliffs, local travel"
"assets/images/places/bizerte_accommodation_21.jpg","place-gallery-accommodation","places.json","Dar Bizerte Sea House gallery","Secondary gallery view for Dar Bizerte Sea House in Bizerte.","Bizerte Tunisia, accommodation, Heritage, Boutique, Local Partner, Sea, Cliffs, gallery"
