"path","category","source","title","description","search_keywords"
"assets/images/places/sidi-bouzid_museum_29.jpg","place-gallery-museum","places.json","Sidi Bouzid Living Heritage House gallery","Secondary gallery view for Sidi Bouzid Living Heritage House in Sidi Bouzid.","Sidi Bouzid Tunisia, museum, Heritage, Museum, Culture, Rural life, Food, gallery"
"assets/images/places/sidi-bouzid_museum_9.jpg","place-main-museum","places.json","Sidi Bouzid Living Heritage House","Compact cultural stop connecting architecture, objects, and stories of the region. A heritage venue in Sidi Bouzid presenting architecture, memory, and craft in a visitor-friendly format.","Sidi Bouzid Tunisia, museum, Heritage, Museum, Culture, Rural life, Food, local travel"
"assets/images/places/sidi-bouzid_naturespot_11.jpg","place-main-natureSpot","places.json","Sidi Bouzid Olive Nature Lookout","Scenic stop for slow walks, light hikes, and panoramic views. Accessible nature point in Sidi Bouzid offering guided walks, open views, and easy half-day planning.","Sidi Bouzid Tunisia, natureSpot, Nature, Panorama, Family, Rural life, Food, local travel"
"assets/images/places/sidi-bouzid_naturespot_31.jpg","place-gallery-natureSpot","places.json","Sidi Bouzid Olive Nature Lookout gallery","Secondary gallery view for Sidi Bouzid Olive Nature Lookout in Sidi Bouzid.","Sidi Bouzid Tunisia, natureSpot, Nature, Panorama, Family, Rural life, Food, gallery"
"assets/images/places/sidi-bouzid_restaurant_23.jpg","place-gallery-restaurant","places.json","Sidi Bouzid Medina Table gallery","Secondary gallery view for Sidi Bouzid Medina Table in Sidi Bouzid.","Sidi Bouzid Tunisia, restaurant, Culinary, Traditional, Local Partner, Rural life, Food, gallery"
"assets/images/places/sidi-bouzid_restaurant_24.jpg","place-gallery-restaurant","places.json","Olive Route Kitchen Sidi Bouzid gallery","Secondary gallery view for Olive Route Kitchen Sidi Bouzid in Sidi Bouzid.","Sidi Bouzid Tunisia, restaurant, Culinary, Chef table, Food, Rural life, Food, gallery"
"assets/images/places/sidi-bouzid_restaurant_3.jpg","place-main-restaurant","places.json","Sidi Bouzid Medina Table","Seasonal Tunisian dishes, market ingredients, and generous local hospitality. A reliable culinary stop in Sidi Bouzid focused on regional recipes, tasting plates, and warm service.","Sidi Bouzid Tunisia, restaurant, Culinary, Traditional, Local Partner, Rural life, Food, local travel"
"assets/images/places/sidi-bouzid_restaurant_4.jpg","place-main-restaurant","places.json","Olive Route Kitchen Sidi Bouzid","Modern local dining with shared plates and regional produce. Contemporary Tunisian cooking in Sidi Bouzid with polished plating and seasonal menus.","Sidi Bouzid Tunisia, restaurant, Culinary, Chef table, Food, Rural life, Food, local travel"
"assets/images/places/sidi-bouzid_transport_10.jpg","place-main-transport","places.json","Sidi Bouzid Local Ride Collective","Private and shared transfer options connecting stations, stays, and key sights. Reliable local transport partner in Sidi Bouzid with airport, station, city, and day-trip options.","Sidi Bouzid Tunisia, transport, Transport, Private ride, Local Partner, Rural life, Food, local travel"
"assets/images/places/sidi-bouzid_transport_30.jpg","place-gallery-transport","places.json","Sidi Bouzid Local Ride Collective gallery","Secondary gallery view for Sidi Bouzid Local Ride Collective in Sidi Bouzid.","Sidi Bouzid Tunisia, transport, Transport, Private ride, Local Partner, Rural life, Food, gallery"
"assets/images/places/siliana_accommodation_1.jpg","place-main-accommodation","places.json","Dar Siliana Olive House","Boutique courtyard stay curated for culture-led city breaks. A design-led local stay in Siliana with breakfast, concierge help, and nearby heritage routes.","Siliana Tunisia, accommodation, Heritage, Boutique, Local Partner, Panorama, Craft, local travel"
"assets/images/places/siliana_accommodation_2.jpg","place-main-accommodation","places.json","Siliana Field Guest Lodge","Comfortable guest stay with easy access to local food and activities. Flexible stay option in Siliana suited to couples, families, and friends exploring the region.","Siliana Tunisia, accommodation, Nature, Comfort, Family, Panorama, Craft, local travel"
"assets/images/places/siliana_accommodation_21.jpg","place-gallery-accommodation","places.json","Dar Siliana Olive House gallery","Secondary gallery view for Dar Siliana Olive House in Siliana.","Siliana Tunisia, accommodation, Heritage, Boutique, Local Partner, Panorama, Craft, gallery"
"assets/images/places/siliana_accommodation_22.jpg","place-gallery-accommodation","places.json","Siliana Field Guest Lodge gallery","Secondary gallery view for Siliana Field Guest Lodge in Siliana.","Siliana Tunisia, accommodation, Nature, Comfort, Family, Panorama, Craft, gallery"
"assets/images/places/siliana_activity_27.jpg","place-gallery-activity","places.json","Siliana Cycling Escape gallery","Secondary gallery view for Siliana Cycling Escape in Siliana.","Siliana Tunisia, activity, Cycling, Adventure, Nature, Panorama, Craft, gallery"
"assets/images/places/siliana_activity_28.jpg","place-gallery-activity","places.json","Siliana Village Adventure Trail gallery","Secondary gallery view for Siliana Village Adventure Trail in Siliana.","Siliana Tunisia, activity, Adventure, Guided, Nature, Panorama, Craft, gallery"
"assets/images/places/siliana_activity_7.jpg","place-main-activity","places.json","Siliana Cycling Escape","Guided cycling route linking scenic stops, food breaks, and local encounters. A cycle-friendly route in Siliana designed for curious travelers seeking active discovery.","Siliana Tunisia, activity, Cycling, Adventure, Nature, Panorama, Craft, local travel"
"assets/images/places/siliana_activity_8.jpg","place-main-activity","places.json","Siliana Village Adventure Trail","Immersive active outing with local guides and strong sense of place. Bookable outdoor adventure in Siliana with local guide support, stories, and practical logistics included.","Siliana Tunisia, activity, Adventure, Guided, Nature, Panorama, Craft, local travel"
"assets/images/places/siliana_artisan_25.jpg","place-gallery-artisan","places.json","Siliana Heritage Atelier gallery","Secondary gallery view for Siliana Heritage Atelier in Siliana.","Siliana Tunisia, artisan, Artisan, Workshop, Local Partner, Panorama, Craft, gallery"
"assets/images/places/siliana_artisan_26.jpg","place-gallery-artisan","places.json","Blue Door Crafts Siliana gallery","Secondary gallery view for Blue Door Crafts Siliana in Siliana.","Siliana Tunisia, artisan, Artisan, Design, Handmade, Panorama, Craft, gallery"
"assets/images/places/siliana_artisan_5.jpg","place-main-artisan","places.json","Siliana Heritage Atelier","Meet makers preserving regional craft gestures through hands-on workshops. Local artisan studio in Siliana offering demonstrations, small-batch products, and cultural context.","Siliana Tunisia, artisan, Artisan, Workshop, Local Partner, Panorama, Craft, local travel"
"assets/images/places/siliana_artisan_6.jpg","place-main-artisan","places.json","Blue Door Crafts Siliana","Textile, ceramics, or woodwork collections inspired by Tunisian detail. Curated artisan address in Siliana where travelers can shop responsibly and learn about local techniques.","Siliana Tunisia, artisan, Artisan, Design, Handmade, Panorama, Craft, local travel"
"assets/images/places/siliana_museum_29.jpg","place-gallery-museum","places.json","Siliana Living Heritage House gallery","Secondary gallery view for Siliana Living Heritage House in Siliana.","Siliana Tunisia, museum, Heritage, Museum, Culture, Panorama, Craft, gallery"
"assets/images/places/siliana_museum_9.jpg","place-main-museum","places.json","Siliana Living Heritage House","Compact cultural stop connecting architecture, objects, and stories of the region. A heritage venue in Siliana presenting architecture, memory, and craft in a visitor-friendly format.","Siliana Tunisia, museum, Heritage, Museum, Culture, Panorama, Craft, local travel"
"assets/images/places/siliana_naturespot_11.jpg","place-main-natureSpot","places.json","Siliana Olive Nature Lookout","Scenic stop for slow walks, light hikes, and panoramic views. Accessible nature point in Siliana offering guided walks, open views, and easy half-day planning.","Siliana Tunisia, natureSpot, Nature, Panorama, Family, Panorama, Craft, local travel"
"assets/images/places/siliana_naturespot_31.jpg","place-gallery-natureSpot","places.json","Siliana Olive Nature Lookout gallery","Secondary gallery view for Siliana Olive Nature Lookout in Siliana.","Siliana Tunisia, natureSpot, Nature, Panorama, Family, Panorama, Craft, gallery"
"assets/images/places/siliana_restaurant_23.jpg","place-gallery-restaurant","places.json","Siliana Medina Table gallery","Secondary gallery view for Siliana Medina Table in Siliana.","Siliana Tunisia, restaurant, Culinary, Traditional, Local Partner, Panorama, Craft, gallery"
"assets/images/places/siliana_restaurant_24.jpg","place-gallery-restaurant","places.json","Olive Route Kitchen Siliana gallery","Secondary gallery view for Olive Route Kitchen Siliana in Siliana.","Siliana Tunisia, restaurant, Culinary, Chef table, Food, Panorama, Craft, gallery"
"assets/images/places/siliana_restaurant_3.jpg","place-main-restaurant","places.json","Siliana Medina Table","Seasonal Tunisian dishes, market ingredients, and generous local hospitality. A reliable culinary stop in Siliana focused on regional recipes, tasting plates, and warm service.","Siliana Tunisia, restaurant, Culinary, Traditional, Local Partner, Panorama, Craft, local travel"
"assets/images/places/siliana_restaurant_4.jpg","place-main-restaurant","places.json","Olive Route Kitchen Siliana","Modern local dining with shared plates and regional produce. Contemporary Tunisian cooking in Siliana with polished plating and seasonal menus.","Siliana Tunisia, restaurant, Culinary, Chef table, Food, Panorama, Craft, local travel"
"assets/images/places/siliana_transport_10.jpg","place-main-transport","places.json","Siliana Local Ride Collective","Private and shared transfer options connecting stations, stays, and key sights. Reliable local transport partner in Siliana with airport, station, city, and day-trip options.","Siliana Tunisia, transport, Transport, Private ride, Local Partner, Panorama, Craft, local travel"
"assets/images/places/siliana_transport_30.jpg","place-gallery-transport","places.json","Siliana Local Ride Collective gallery","Secondary gallery view for Siliana Local Ride Collective in Siliana.","Siliana Tunisia, transport, Transport, Private ride, Local Partner, Panorama, Craft, gallery"
"assets/images/places/sousse_accommodation_1.jpg","place-main-accommodation","places.json","Dar Sousse Sea House","Boutique courtyard stay curated for culture-led city breaks. A design-led local stay in Sousse with breakfast, concierge help, and nearby heritage routes.","Sousse Tunisia, accommodation, Heritage, Boutique, Local Partner, Beach, Nightlife, local travel"
"assets/images/places/sousse_accommodation_2.jpg","place-main-accommodation","places.json","Sousse Harbor Guest Lodge","Comfortable guest stay with easy access to local food and activities. Flexible stay option in Sousse suited to couples, families, and friends exploring the region.","Sousse Tunisia, accommodation, Nature, Comfort, Family, Beach, Nightlife, local travel"
"assets/images/places/sousse_accommodation_21.jpg","place-gallery-accommodation","places.json","Dar Sousse Sea House gallery","Secondary gallery view for Dar Sousse Sea House in Sousse.","Sousse Tunisia, accommodation, Heritage, Boutique, Local Partner, Beach, Nightlife, gallery"
"assets/images/places/sousse_accommodation_22.jpg","place-gallery-accommodation","places.json","Sousse Harbor Guest Lodge gallery","Secondary gallery view for Sousse Harbor Guest Lodge in Sousse.","Sousse Tunisia, accommodation, Nature, Comfort, Family, Beach, Nightlife, gallery"
"assets/images/places/sousse_activity_27.jpg","place-gallery-activity","places.json","Sousse Cycling Escape gallery","Secondary gallery view for Sousse Cycling Escape in Sousse.","Sousse Tunisia, activity, Cycling, Adventure, Nature, Beach, Nightlife, gallery"
"assets/images/places/sousse_activity_28.jpg","place-gallery-activity","places.json","Sousse Breeze Adventure Trail gallery","Secondary gallery view for Sousse Breeze Adventure Trail in Sousse.","Sousse Tunisia, activity, Adventure, Guided, Nature, Beach, Nightlife, gallery"
"assets/images/places/sousse_activity_7.jpg","place-main-activity","places.json","Sousse Cycling Escape","Guided cycling route linking scenic stops, food breaks, and local encounters. A cycle-friendly route in Sousse designed for curious travelers seeking active discovery.","Sousse Tunisia, activity, Cycling, Adventure, Nature, Beach, Nightlife, local travel"
"assets/images/places/sousse_activity_8.jpg","place-main-activity","places.json","Sousse Breeze Adventure Trail","Immersive active outing with local guides and strong sense of place. Bookable outdoor adventure in Sousse with local guide support, stories, and practical logistics included.","Sousse Tunisia, activity, Adventure, Guided, Nature, Beach, Nightlife, local travel"
"assets/images/places/sousse_artisan_25.jpg","place-gallery-artisan","places.json","Sousse Heritage Atelier gallery","Secondary gallery view for Sousse Heritage Atelier in Sousse.","Sousse Tunisia, artisan, Artisan, Workshop, Local Partner, Beach, Nightlife, gallery"
"assets/images/places/sousse_artisan_26.jpg","place-gallery-artisan","places.json","Blue Door Crafts Sousse gallery","Secondary gallery view for Blue Door Crafts Sousse in Sousse.","Sousse Tunisia, artisan, Artisan, Design, Handmade, Beach, Nightlife, gallery"
"assets/images/places/sousse_artisan_5.jpg","place-main-artisan","places.json","Sousse Heritage Atelier","Meet makers preserving regional craft gestures through hands-on workshops. Local artisan studio in Sousse offering demonstrations, small-batch products, and cultural context.","Sousse Tunisia, artisan, Artisan, Workshop, Local Partner, Beach, Nightlife, local travel"
"assets/images/places/sousse_artisan_6.jpg","place-main-artisan","places.json","Blue Door Crafts Sousse","Textile, ceramics, or woodwork collections inspired by Tunisian detail. Curated artisan address in Sousse where travelers can shop responsibly and learn about local techniques.","Sousse Tunisia, artisan, Artisan, Design, Handmade, Beach, Nightlife, local travel"
"assets/images/places/sousse_museum_29.jpg","place-gallery-museum","places.json","Sousse Living Heritage House gallery","Secondary gallery view for Sousse Living Heritage House in Sousse.","Sousse Tunisia, museum, Heritage, Museum, Culture, Beach, Nightlife, gallery"
"assets/images/places/sousse_museum_9.jpg","place-main-museum","places.json","Sousse Living Heritage House","Compact cultural stop connecting architecture, objects, and stories of the region. A heritage venue in Sousse presenting architecture, memory, and craft in a visitor-friendly format.","Sousse Tunisia, museum, Heritage, Museum, Culture, Beach, Nightlife, local travel"
"assets/images/places/sousse_naturespot_11.jpg","place-main-natureSpot","places.json","Sousse Sea Nature Lookout","Scenic stop for slow walks, light hikes, and panoramic views. Accessible nature point in Sousse offering guided walks, open views, and easy half-day planning.","Sousse Tunisia, natureSpot, Nature, Panorama, Family, Beach, Nightlife, local travel"
"assets/images/places/sousse_naturespot_31.jpg","place-gallery-natureSpot","places.json","Sousse Sea Nature Lookout gallery","Secondary gallery view for Sousse Sea Nature Lookout in Sousse.","Sousse Tunisia, natureSpot, Nature, Panorama, Family, Beach, Nightlife, gallery"
"assets/images/places/sousse_restaurant_23.jpg","place-gallery-restaurant","places.json","Sousse Medina Table gallery","Secondary gallery view for Sousse Medina Table in Sousse.","Sousse Tunisia, restaurant, Culinary, Traditional, Local Partner, Beach, Nightlife, gallery"
"assets/images/places/sousse_restaurant_24.jpg","place-gallery-restaurant","places.json","Olive Route Kitchen Sousse gallery","Secondary gallery view for Olive Route Kitchen Sousse in Sousse.","Sousse Tunisia, restaurant, Culinary, Chef table, Food, Beach, Nightlife, gallery"
"assets/images/places/sousse_restaurant_3.jpg","place-main-restaurant","places.json","Sousse Medina Table","Seasonal Tunisian dishes, market ingredients, and generous local hospitality. A reliable culinary stop in Sousse focused on regional recipes, tasting plates, and warm service.","Sousse Tunisia, restaurant, Culinary, Traditional, Local Partner, Beach, Nightlife, local travel"
"assets/images/places/sousse_restaurant_4.jpg","place-main-restaurant","places.json","Olive Route Kitchen Sousse","Modern local dining with shared plates and regional produce. Contemporary Tunisian cooking in Sousse with polished plating and seasonal menus.","Sousse Tunisia, restaurant, Culinary, Chef table, Food, Beach, Nightlife, local travel"
"assets/images/places/sousse_transport_10.jpg","place-main-transport","places.json","Sousse Local Ride Collective","Private and shared transfer options connecting stations, stays, and key sights. Reliable local transport partner in Sousse with airport, station, city, and day-trip options.","Sousse Tunisia, transport, Transport, Private ride, Local Partner, Beach, Nightlife, local travel"
"assets/images/places/sousse_transport_30.jpg","place-gallery-transport","places.json","Sousse Local Ride Collective gallery","Secondary gallery view for Sousse Local Ride Collective in Sousse.","Sousse Tunisia, transport, Transport, Private ride, Local Partner, Beach, Nightlife, gallery"
"assets/images/places/tataouine_accommodation_1.jpg","place-main-accommodation","places.json","Dar Tataouine Desert House","Boutique courtyard stay curated for culture-led city breaks. A design-led local stay in Tataouine with breakfast, concierge help, and nearby heritage routes.","Tataouine Tunisia, accommodation, Heritage, Boutique, Local Partner, Desert, Ksour, local travel"
"assets/images/places/tataouine_accommodation_2.jpg","place-main-accommodation","places.json","Tataouine Ksar Guest Lodge","Comfortable guest stay with easy access to local food and activities. Flexible stay option in Tataouine suited to couples, families, and friends exploring the region.","Tataouine Tunisia, accommodation, Nature, Comfort, Family, Desert, Ksour, local travel"
"assets/images/places/tataouine_accommodation_21.jpg","place-gallery-accommodation","places.json","Dar Tataouine Desert House gallery","Secondary gallery view for Dar Tataouine Desert House in Tataouine.","Tataouine Tunisia, accommodation, Heritage, Boutique, Local Partner, Desert, Ksour, gallery"
"assets/images/places/tataouine_accommodation_22.jpg","place-gallery-accommodation","places.json","Tataouine Ksar Guest Lodge gallery","Secondary gallery view for Tataouine Ksar Guest Lodge in Tataouine.","Tataouine Tunisia, accommodation, Nature, Comfort, Family, Desert, Ksour, gallery"
"assets/images/places/tataouine_activity_27.jpg","place-gallery-activity","places.json","Tataouine Cycling Escape gallery","Secondary gallery view for Tataouine Cycling Escape in Tataouine.","Tataouine Tunisia, activity, Cycling, Adventure, Nature, Desert, Ksour, gallery"
"assets/images/places/tataouine_activity_28.jpg","place-gallery-activity","places.json","Tataouine Dune Adventure Trail gallery","Secondary gallery view for Tataouine Dune Adventure Trail in Tataouine.","Tataouine Tunisia, activity, Adventure, Guided, Nature, Desert, Ksour, gallery"
"assets/images/places/tataouine_activity_7.jpg","place-main-activity","places.json","Tataouine Cycling Escape","Guided cycling route linking scenic stops, food breaks, and local encounters. A cycle-friendly route in Tataouine designed for curious travelers seeking active discovery.","Tataouine Tunisia, activity, Cycling, Adventure, Nature, Desert, Ksour, local travel"
"assets/images/places/tataouine_activity_8.jpg","place-main-activity","places.json","Tataouine Dune Adventure Trail","Immersive active outing with local guides and strong sense of place. Bookable outdoor adventure in Tataouine with local guide support, stories, and practical logistics included.","Tataouine Tunisia, activity, Adventure, Guided, Nature, Desert, Ksour, local travel"
"assets/images/places/tataouine_artisan_25.jpg","place-gallery-artisan","places.json","Tataouine Heritage Atelier gallery","Secondary gallery view for Tataouine Heritage Atelier in Tataouine.","Tataouine Tunisia, artisan, Artisan, Workshop, Local Partner, Desert, Ksour, gallery"
"assets/images/places/tataouine_artisan_26.jpg","place-gallery-artisan","places.json","Blue Door Crafts Tataouine gallery","Secondary gallery view for Blue Door Crafts Tataouine in Tataouine.","Tataouine Tunisia, artisan, Artisan, Design, Handmade, Desert, Ksour, gallery"
"assets/images/places/tataouine_artisan_5.jpg","place-main-artisan","places.json","Tataouine Heritage Atelier","Meet makers preserving regional craft gestures through hands-on workshops. Local artisan studio in Tataouine offering demonstrations, small-batch products, and cultural context.","Tataouine Tunisia, artisan, Artisan, Workshop, Local Partner, Desert, Ksour, local travel"
"assets/images/places/tataouine_artisan_6.jpg","place-main-artisan","places.json","Blue Door Crafts Tataouine","Textile, ceramics, or woodwork collections inspired by Tunisian detail. Curated artisan address in Tataouine where travelers can shop responsibly and learn about local techniques.","Tataouine Tunisia, artisan, Artisan, Design, Handmade, Desert, Ksour, local travel"
"assets/images/places/tataouine_museum_29.jpg","place-gallery-museum","places.json","Tataouine Living Heritage House gallery","Secondary gallery view for Tataouine Living Heritage House in Tataouine.","Tataouine Tunisia, museum, Heritage, Museum, Culture, Desert, Ksour, gallery"
"assets/images/places/tataouine_museum_9.jpg","place-main-museum","places.json","Tataouine Living Heritage House","Compact cultural stop connecting architecture, objects, and stories of the region. A heritage venue in Tataouine presenting architecture, memory, and craft in a visitor-friendly format.","Tataouine Tunisia, museum, Heritage, Museum, Culture, Desert, Ksour, local travel"
"assets/images/places/tataouine_naturespot_11.jpg","place-main-natureSpot","places.json","Tataouine Desert Nature Lookout","Scenic stop for slow walks, light hikes, and panoramic views. Accessible nature point in Tataouine offering guided walks, open views, and easy half-day planning.","Tataouine Tunisia, natureSpot, Nature, Panorama, Family, Desert, Ksour, local travel"
"assets/images/places/tataouine_naturespot_31.jpg","place-gallery-natureSpot","places.json","Tataouine Desert Nature Lookout gallery","Secondary gallery view for Tataouine Desert Nature Lookout in Tataouine.","Tataouine Tunisia, natureSpot, Nature, Panorama, Family, Desert, Ksour, gallery"
"assets/images/places/tataouine_restaurant_23.jpg","place-gallery-restaurant","places.json","Tataouine Medina Table gallery","Secondary gallery view for Tataouine Medina Table in Tataouine.","Tataouine Tunisia, restaurant, Culinary, Traditional, Local Partner, Desert, Ksour, gallery"
"assets/images/places/tataouine_restaurant_24.jpg","place-gallery-restaurant","places.json","Olive Route Kitchen Tataouine gallery","Secondary gallery view for Olive Route Kitchen Tataouine in Tataouine.","Tataouine Tunisia, restaurant, Culinary, Chef table, Food, Desert, Ksour, gallery"
"assets/images/places/tataouine_restaurant_3.jpg","place-main-restaurant","places.json","Tataouine Medina Table","Seasonal Tunisian dishes, market ingredients, and generous local hospitality. A reliable culinary stop in Tataouine focused on regional recipes, tasting plates, and warm service.","Tataouine Tunisia, restaurant, Culinary, Traditional, Local Partner, Desert, Ksour, local travel"
"assets/images/places/tataouine_restaurant_4.jpg","place-main-restaurant","places.json","Olive Route Kitchen Tataouine","Modern local dining with shared plates and regional produce. Contemporary Tunisian cooking in Tataouine with polished plating and seasonal menus.","Tataouine Tunisia, restaurant, Culinary, Chef table, Food, Desert, Ksour, local travel"
"assets/images/places/tataouine_transport_10.jpg","place-main-transport","places.json","Tataouine Local Ride Collective","Private and shared transfer options connecting stations, stays, and key sights. Reliable local transport partner in Tataouine with airport, station, city, and day-trip options.","Tataouine Tunisia, transport, Transport, Private ride, Local Partner, Desert, Ksour, local travel"
"assets/images/places/tataouine_transport_30.jpg","place-gallery-transport","places.json","Tataouine Local Ride Collective gallery","Secondary gallery view for Tataouine Local Ride Collective in Tataouine.","Tataouine Tunisia, transport, Transport, Private ride, Local Partner, Desert, Ksour, gallery"
"assets/images/places/tozeur_accommodation_1.jpg","place-main-accommodation","places.json","Dar Tozeur Palm House","Boutique courtyard stay curated for culture-led city breaks. A design-led local stay in Tozeur with breakfast, concierge help, and nearby heritage routes.","Tozeur Tunisia, accommodation, Heritage, Boutique, Local Partner, Oasis, Desert, local travel"
"assets/images/places/tozeur_accommodation_2.jpg","place-main-accommodation","places.json","Tozeur Oasis Guest Lodge","Comfortable guest stay with easy access to local food and activities. Flexible stay option in Tozeur suited to couples, families, and friends exploring the region.","Tozeur Tunisia, accommodation, Nature, Comfort, Family, Oasis, Desert, local travel"
